{
  "eventId": "11111111-1111-4111-8111-111111111111",
  "eventType": "catalog.product.published.v1",
  "version": 1,
  "occurredAt": "2026-05-10T13:00:00Z",
  "correlationId": "catalog-product-123",
  "payload": {
    "productId": "22222222-2222-4222-8222-222222222222",
    "sellerId": "33333333-3333-4333-8333-333333333333",
    "categoryId": "44444444-4444-4444-8444-444444444444",
    "name": "Organic Carrots",
    "unit": "kg",
    "packageSize": "1 kg bag",
    "priceAmount": 7.50,
    "currency": "USD",
    "status": "PUBLISHED"
  }
}
